{
  "schema_version": "6.0",
  "scan_type": "scoring",
  "scan_date": "2026-03-31",
  "agent_model": "claude-opus-4-6[1m]",
  "repo": {
    "owner": "input-output-hk",
    "name": "mithril",
    "ecosystem": "rust",
    "project": "mithril"
  },
  "opportunity_map": [
    {
      "id": "opp-mithril-rs_unsafe_audit",
      "title": "AI-assisted review of unsafe blocks in mithril-stm cryptographic multi-signature implementation",
      "value": "HIGH",
      "effort": "Low",
      "roi_rank": 1,
      "evidence": "mithril-stm/ is the core STM crypto library implementing stake-based threshold multi-signatures. Active SNARK prover work: PR #3105 (deploy SNARK prover in dev networks, merged 2026-03-31), PR #3103 (wire SNARK proof in aggregate signature, merged 2026-03-30). Commit 994a4b9 references 'SNARK AVK' in protocol message creation. Cryptographic crates in Rust commonly use unsafe blocks for performance. deny.toml exists (743 bytes) confirming security awareness.",
      "kb_pattern": "rs_unsafe_audit",
      "seen_in": [],
      "adversarial_status": "approved",
      "adversarial_reason": "Targets specific crate (mithril-stm) with active crypto development. Cannot confirm unsafe block count from tree alone (MEDIUM confidence) but crate purpose and SNARK work strongly suggest unsafe usage."
    },
    {
      "id": "opp-mithril-cc_aiignore_boundaries",
      "title": "Create .aiignore trust boundaries for mithril-stm and SNARK prover paths",
      "value": "HIGH",
      "effort": "Low",
      "roi_rank": 2,
      "evidence": ".aiignore ABSENT (confirmed in repo-data-summary). .github/copilot-instructions.md EXISTS (7091 bytes) confirming AI tools are configured. Security-critical paths: mithril-stm/ (cryptographic primitives), mithril-signer/ (signing operations). No explicit trust boundaries prevent AI from modifying crypto code.",
      "kb_pattern": "cc_aiignore_boundaries",
      "seen_in": [],
      "adversarial_status": "approved",
      "adversarial_reason": "Specific paths identified (mithril-stm, mithril-signer). AI config present (copilot-instructions.md) without trust boundaries is a concrete gap."
    },
    {
      "id": "opp-mithril-rs_debug_async",
      "title": "AI-assisted debugging of async concurrency in mithril-aggregator and mithril-signer network services",
      "value": "HIGH",
      "effort": "Low",
      "roi_rank": 3,
      "evidence": "mithril-aggregator/ and mithril-signer/ are network services handling multi-party signature aggregation and signing. Version bumps in commit a33d505 (mithril-aggregator 0.8.38->0.8.39, mithril-signer 0.3.25->0.3.26). As network services processing concurrent signer registrations and signature aggregation, these services almost certainly use tokio async runtime (MEDIUM confidence -- inferred from architecture, not confirmed via Cargo.toml inspection).",
      "kb_pattern": "rs_debug_async",
      "seen_in": [],
      "adversarial_status": "approved",
      "adversarial_reason": "Specific services named. Async runtime inferred from network service architecture. Active development confirmed via recent version bumps."
    },
    {
      "id": "opp-mithril-cc_claude_md_context",
      "title": "Write substantive CLAUDE.md covering mithril's 25+ crate workspace architecture, STM protocol boundaries, and security-critical signing paths",
      "value": "HIGH",
      "effort": "Medium",
      "roi_rank": 4,
      "evidence": "CLAUDE.md is 14 bytes (placeholder/404 -- confirmed in repo-data-summary). Cargo workspace has 25+ members spanning demo, examples, internal, and top-level service crates (confirmed in repo-data-summary). .github/copilot-instructions.md exists (7091 bytes) showing AI tool investment, but CLAUDE.md is empty. Complex domain (stake-based threshold multi-signatures with SNARK proofs) requires project context for effective AI interaction.",
      "kb_pattern": "cc_claude_md_context",
      "seen_in": [
        {
          "repo": "input-output-hk/lace-platform",
          "outcome": "comprehensive CLAUDE.md covering architecture, conventions, testing -- measurably better AI interactions"
        }
      ],
      "adversarial_status": "approved",
      "adversarial_reason": "Effort adjusted from Low to Medium by Stage A due to 25+ crate complexity. copilot-instructions.md presence shows AI tool investment; empty CLAUDE.md is a specific gap with evidence."
    },
    {
      "id": "opp-mithril-rs_cargo_deny_audit",
      "title": "Audit cargo-deny configuration in deny.toml for advisory scanning completeness",
      "value": "MEDIUM",
      "effort": "Low",
      "roi_rank": 5,
      "evidence": "deny.toml EXISTS at repo root (743 bytes, confirmed in tree.json sha ca955199776b22378ceefcd955753b009a4e0847). Cannot confirm whether 'cargo deny check advisories' runs in CI vs only 'cargo deny check licenses' without reading CI workflow contents. KB pattern seen_in includes this repo from previous observation.",
      "kb_pattern": "rs_cargo_deny_audit",
      "seen_in": [
        {
          "repo": "input-output-hk/mithril",
          "outcome": "cargo deny check licenses found but cargo deny check advisories was the actual security check"
        }
      ],
      "adversarial_status": "approved",
      "adversarial_reason": "deny.toml confirmed present. KB pattern directly references this repo. Cannot verify CI command from collected data but the audit itself is the value."
    },
    {
      "id": "opp-mithril-rs_rustdoc_generation",
      "title": "AI-generated rustdoc for underdocumented internal/ crates (mithril-era, mithril-persistence, mithril-metric, mithril-dmq)",
      "value": "MEDIUM",
      "effort": "Low",
      "roi_rank": 6,
      "evidence": "internal/ directory contains 18+ crates (confirmed in workspace members: mithril-era, mithril-persistence, mithril-metric, mithril-dmq, mithril-resource-pool, mithril-ticker, etc.). These are infrastructure crates depended upon by service crates. Commit 4ac1a10 renames era reader adapter in mithril-era, confirming active development. Internal crates typically have sparser documentation than public-facing crates.",
      "kb_pattern": "rs_rustdoc_generation",
      "seen_in": [],
      "adversarial_status": "approved",
      "adversarial_reason": "Specific internal crates named. Active development confirmed (mithril-era commit). Documentation sparseness inferred (MEDIUM confidence)."
    },
    {
      "id": "opp-mithril-rs_trait_test_gen",
      "title": "AI-generated property tests for trait implementations across mithril-common and mithril-stm",
      "value": "MEDIUM",
      "effort": "Medium",
      "roi_rank": 7,
      "evidence": "mithril-common is a shared library depended upon by most workspace crates (high fan-in -- listed as dependency path in 25+ workspace members). mithril-stm implements cryptographic trait contracts for multi-signature operations. Trait correctness across types is critical for protocol security. Cannot confirm proptest/quickcheck presence from collected data (MEDIUM confidence).",
      "kb_pattern": "rs_trait_test_gen",
      "seen_in": [],
      "adversarial_status": "approved",
      "adversarial_reason": "Specific crates named with rationale. Fan-in inferred from workspace structure. Property test framework presence unconfirmed."
    },
    {
      "id": "opp-mithril-cc_pr_descriptions-REJECTED",
      "title": "AI-assisted PR description generation for mithril's active PR workflow",
      "value": "MEDIUM",
      "effort": "Low",
      "roi_rank": 99,
      "evidence": "PR template exists at .github/pull_request_template.md (985 bytes). Sampled PRs (#3105, #3103) have structured descriptions with Content sections, Pre-submit checklists, and Issue references.",
      "kb_pattern": "cc_pr_descriptions",
      "seen_in": [],
      "adversarial_status": "rejected",
      "adversarial_reason": "PRs #3105 and #3103 already have structured descriptions with content sections, checklists, and issue references. PR template exists. The team is already doing this well -- the opportunity addresses a problem that does not exist here."
    }
  ],
  "adoption_state": [
    {
      "opportunity_id": "opp-mithril-rs_unsafe_audit",
      "state": "Absent",
      "evidence": "Zero AI co-authored-by trailers in commit history. No AI-attributed commits touching mithril-stm/. copilot-instructions.md exists but no evidence of AI being used for unsafe code review specifically. No observable AI attribution found. This does not confirm absence of AI use -- attribution is not universally enforced."
    },
    {
      "opportunity_id": "opp-mithril-cc_aiignore_boundaries",
      "state": "Absent",
      "evidence": ".aiignore does not exist. copilot-instructions.md exists (7091 bytes) but addresses coding guidance, not trust boundaries. No observable signal of trust boundary configuration. This does not confirm absence of trust boundary practices outside the repo."
    },
    {
      "opportunity_id": "opp-mithril-rs_debug_async",
      "state": "Absent",
      "evidence": "Zero AI co-authored-by trailers. No AI-attributed commits touching mithril-aggregator/ or mithril-signer/. No observable AI attribution found. This does not confirm absence of AI use -- attribution is not universally enforced."
    },
    {
      "opportunity_id": "opp-mithril-cc_claude_md_context",
      "state": "Absent",
      "evidence": "CLAUDE.md is 14 bytes (placeholder returning 404). No substantive AI project context file. copilot-instructions.md exists (7091 bytes) which is a partial signal but not CLAUDE.md. Per anti-pattern ap_generic_claude_md: a placeholder/empty CLAUDE.md scores the same as no CLAUDE.md for Adoption State."
    },
    {
      "opportunity_id": "opp-mithril-rs_cargo_deny_audit",
      "state": "Absent",
      "evidence": "deny.toml exists but no evidence of AI being used to audit or maintain it. Zero AI-attributed commits. No observable AI attribution found."
    },
    {